Symbol,Name,Last Sale,Net Change,% Change,Market Cap,Country,IPO Year,Volume,Sector,Industry
CSL,Carlisle Companies Incorporated Common Stock,$204.81,-0.03,-0.015%,10675843317.00,United States,,210200,,
CSLT,Castlight Health Inc. Class B Common Stock,$1.70,0.00,0.00%,272428176.00,,2014,167189,Health Care,Managed Health Care
CSPR,Casper Sleep Inc. Common Stock,$4.18,0.06,1.456%,173255788.00,,2020,489938,Miscellaneous,Diversified Commercial Services
CSR,D/B/A Centerspace Common Stock,$96.66,0.08,0.083%,1357576168.00,United States,,58706,Consumer Services,Building operators
CSR^C,D/B/A Centerspace 6.625% Series C ,$26.00,0.15,0.58%,,United States,,1732,,
CSTA,Constellation Acquisition Corp I Class A Ordinary Shares,$9.79,0.00,0.00%,387928750.00,,2021,114,Finance,Business Services
CSTM,Constellium SE Ordinary Shares (France),$18.96,-0.24,-1.25%,2686202859.00,Netherlands,2013,1143067,Basic Industries,Metal Fabrications
CSU,Capital Senior Living Corporation Common Stock,$31.10,-0.80,-2.508%,68127629.00,United States,1997,4835,Health Care,Hospital/Nursing Management
CSV,Carriage Services Inc. Common Stock,$45.57,-0.09,-0.197%,812318243.00,United States,,32224,Miscellaneous,Other Consumer Services
CTA^A,E.I. du Pont de Nemours and Company Preferred Stock,$93.81,-0.93,-0.982%,,United States,,294,,
CTA^B,E.I. du Pont de Nemours and Company Preferred Stock,$111.9899,0.00,0.00%,,United States,,125,,
CTBB,Qwest Corporation 6.5% Notes due 2056,$25.37,-0.02,-0.079%,0.00,United States,2016,40054,,
CTDD,Qwest Corporation 6.75% Notes due 2057,$26.22,0.03,0.115%,0.00,United States,2017,11705,,
CTK,CooTek (Cayman) Inc. American Depositary Shares each representing 50 Class A Ordinary Shares,$1.22,0.09,7.965%,79921656.00,,2018,177945,Technology,EDP Services
CTLT,Catalent Inc. Common Stock,$128.53,-1.81,-1.389%,21960652509.00,United States,2014,355624,Health Care,Biotechnology: Pharmaceutical Preparations
CTO,CTO Realty Growth Inc. Common Stock,$53.49,0.19,0.356%,318615325.00,United States,,17421,Consumer Services,Real Estate Investment Trusts
CTO^A,CTO Realty Growth Inc. 6.375% Series A Cumulative Redeemable Preferred Stock,$25.35,-0.12,-0.471%,,United States,,1886,,
CTOS,Custom Truck One Source Inc. Common Stock,$8.42,-0.11,-1.29%,2070639538.00,Cayman Islands,2017,237663,Technology,Diversified Commercial Services
CTR,ClearBridge MLP and Midstream Total Return Fund Inc. Common Stock,$25.88,0.54,2.131%,184203462.00,United States,2012,29249,Finance,Investment Managers
CTRA,Coterra Energy Inc. Common Stock,$21.52,-0.75,-3.368%,17510051454.00,United States,,9323643,Energy,Oil & Gas Production
CTS,CTS Corporation Common Stock,$31.55,-0.31,-0.973%,1023058410.00,United States,,53467,Capital Goods,Industrial Machinery/Components
CTT,CatchMark Timber Trust Inc. Class A Common Stock,$12.21,0.25,2.09%,597058915.00,United States,2013,85917,Consumer Services,Real Estate Investment Trusts
CTVA,Corteva Inc. Common Stock ,$42.46,-0.32,-0.748%,31173495100.00,,2019,1257912,Basic Industries,Major Chemicals
CUBE,CubeSmart Common Shares,$49.09,0.39,0.801%,9904894553.00,United States,,559464,Consumer Services,Real Estate Investment Trusts
CUBI,Customers Bancorp Inc Common Stock,$43.88,-0.88,-1.966%,1420569145.00,United States,,141824,Finance,Major Banks
CUBI^E,Customers Bancorp Inc Fixed-to-Floating Rate Non-Cumulative Perpetual Preferred Stock Series E,$25.04,-0.09,-0.358%,,United States,,27092,,
CUBI^F,Customers Bancorp Inc Fixed-to-Floating Rate Non-Cumulative Perpetual Preferred Stock Series F,$25.07,-0.03,-0.12%,,United States,,45862,,
CUK,Carnival Plc ADS ADS,$21.67,-0.02,-0.092%,25241001814.00,United States,,1283364,,
CULP,Culp Inc. Common Stock,$13.04,-0.07,-0.534%,159130823.00,United States,,27379,Basic Industries,Textiles
CURO,CURO Group Holdings Corp. Common Stock,$18.93,0.43,2.324%,784263104.00,,2017,150751,Finance,Diversified Financial Services
CURV,Torrid Holdings Inc. Common Stock,$13.99,-0.76,-5.153%,1540025468.00,,2021,242812,Consumer Services,Clothing/Shoe/Accessory Stores
CUZ,Cousins Properties Incorporated Common Stock,$39.02,0.23,0.593%,5801807165.00,United States,,578180,Consumer Services,Real Estate Investment Trusts
CVA,Covanta Holding Corporation Common Stock,$20.11,-0.06,-0.297%,2674814650.00,United States,,496180,,
CVE,Cenovus Energy Inc Common Stock,$11.47,0.19,1.684%,23142009640.00,Canada,,10819236,,
CVEO,Civeo Corporation (Canada) Common Shares,$22.08,0.58,2.698%,316103330.00,,2014,32640,,
CVI,CVR Energy Inc. Common Stock,$19.67,0.89,4.739%,1977436882.00,United States,2007,1169470,Energy,Integrated oil Companies
CVII,Churchill Capital Corp VII Class A Common Stock,$9.79,0.00,0.00%,1688775000.00,,2021,36090,,
CVNA,Carvana Co. Class A Common Stock,$282.74,0.31,0.11%,23892109900.00,United States,2017,663135,Consumer Services,Other Specialty Stores
CVS,CVS Health Corporation Common Stock,$84.28,-0.09,-0.107%,111213759424.00,United States,,3283353,Health Care,Managed Health Care
CVX,Chevron Corporation Common Stock,$107.13,-0.92,-0.851%,207179986561.00,United States,,9791879,Energy,Integrated oil Companies
CW,Curtiss-Wright Corporation Common Stock,$129.27,-3.92,-2.943%,5285074551.00,United States,,242364,Capital Goods,Industrial Machinery/Components
CWAN,Clearwater Analytics Holdings Inc. Class A Common Stock,$23.13,-0.09,-0.388%,4000329892.00,,2021,233417,Technology,Computer Software: Prepackaged Software
CWEN,Clearway Energy Inc. Class C Common Stock,$33.46,1.15,3.559%,3893416040.00,United States,2015,1690783,Public Utilities,Electric Utilities: Central
CWH,Camping World Holdings Inc. Class A Commom Stock,$40.39,0.11,0.273%,3536931822.00,United States,2016,428187,Consumer Services,Other Specialty Stores
CWK,Cushman & Wakefield plc Ordinary Shares,$18.30,0.01,0.055%,4085445080.00,,2018,720866,Finance,Real Estate
CWT,California Water Service Group Common Stock,$60.39,0.11,0.182%,3112198650.00,United States,,101406,Public Utilities,Water Supply
CX,Cemex S.A.B. de C.V. Sponsored ADR,$6.66,0.14,2.147%,9809494500.00,Mexico,,12154540,Capital Goods,Building Materials
CXE,MFS High Income Municipal Trust Common Stock,$5.21,-0.03,-0.573%,164238310.00,United States,1989,37067,Finance,Investment Managers
CXH,MFS Investment Grade Municipal Trust Common Stock,$9.865,-0.0048,-0.049%,89872567.00,United States,1989,5344,Finance,Investment Managers
CXM,Sprinklr Inc. Class A Common Stock,$16.20,-0.68,-4.028%,4131547139.00,,2021,419725,Technology,Computer Software: Prepackaged Software
CXP,Columbia Property Trust Inc. Common Stock,$19.12,-0.03,-0.157%,2196863775.00,United States,2013,455471,Consumer Services,Real Estate Investment Trusts
CXW,CoreCivic Inc. Common Stock,$9.51,0.11,1.17%,1143908115.00,United States,,718920,Consumer Services,Real Estate Investment Trusts
CYD,China Yuchai International Limited Common Stock,$13.87,-0.05,-0.359%,566704482.00,Singapore,1994,26875,Capital Goods,Construction/Ag Equipment/Trucks
CYH,Community Health Systems Inc. Common Stock,$10.34,-0.31,-2.911%,1365687616.00,United States,2000,921518,Health Care,Hospital/Nursing Management
CZOO,Cazoo Group Ltd Class A Ordinary Shares,$7.21,0.20,2.853%,5423021969.00,,,543780,Consumer Durables,Automotive Aftermarket
D,Dominion Energy Inc. Common Stock,$72.12,-0.58,-0.798%,58308105807.00,United States,,2781954,Public Utilities,Electric Utilities: Central
DAC,Danaos Corporation Common Stock,$70.92,-1.31,-1.814%,1460876825.00,Greece,2006,294933,Transportation,Marine Transportation
DAL,Delta Air Lines Inc. Common Stock,$43.19,-0.19,-0.438%,27637923581.00,United States,,9080630,Transportation,Air Freight/Delivery Services
DAN,Dana Incorporated Common Stock ,$24.34,-0.18,-0.734%,3534869406.00,United States,,691070,Capital Goods,Auto Parts:O.E.M.
DAO,Youdao Inc. American Depositary Shares each representing one Class A Ordinary Share,$13.33,0.12,0.908%,1652666143.00,,2019,169489,Consumer Services,Other Consumer Services
DAR,Darling Ingredients Inc. Common Stock,$72.41,-0.27,-0.371%,11735473928.00,United States,,655931,Consumer Non-Durables,Farming/Seeds/Milling
DASH,DoorDash Inc. Class A Common Stock,$195.30,-9.12,-4.461%,65998983607.00,,2020,1511376,Capital Goods,Industrial Machinery/Components
DAVA,Endava plc American Depositary Shares (each representing one Class A Ordinary Share),$149.47,-4.09,-2.663%,8329007987.00,,2018,136404,Technology,EDP Services
DB,Deutsche Bank AG Common Stock,$13.16,-0.06,-0.454%,27158730267.00,Germany,,3307903,Finance,Commercial Banks
DBD,Diebold Nixdorf Incorporated Common Stock,$10.14,-0.12,-1.17%,794507603.00,United States,,268478,Technology,EDP Services
DBI,Designer Brands Inc. Class A Common Stock,$12.51,-1.21,-8.819%,913225584.00,United States,,1751122,Consumer Services,Clothing/Shoe/Accessory Stores
DBL,DoubleLine Opportunistic Credit Fund Common Shares of Beneficial Interest,$19.69,-0.07,-0.354%,294798956.00,United States,2012,24322,,
DBRG,DigitalBridge Group Inc.,$6.69,-0.01,-0.149%,3298853176.00,United States,2014,2939704,Consumer Services,Real Estate Investment Trusts
DBRG^H,DigitalBridge Group Inc. 7.125% Series H ,$25.155,0.025,0.099%,,United States,,3376,,
DBRG^I,DigitalBridge Group Inc. 7.15% Series I ,$25.55,-0.24,-0.931%,,United States,,8294,,
DBRG^J,DigitalBridge Group Inc. 7.125% Series J ,$26.08,0.026,0.10%,,United States,,4072,,
DCF,BNY Mellon Alcentra Global Credit Income 2024 Target Term Fund Inc. Common Stock,$9.51,0.02,0.211%,142299385.00,,2017,13482,Finance,Finance/Investors Services
DCI,Donaldson Company Inc. Common Stock,$57.04,-1.07,-1.841%,7049865303.00,United States,,197201,Capital Goods,Pollution Control Equipment
DCO,Ducommun Incorporated Common Stock,$49.89,-1.33,-2.597%,594704865.00,United States,,18059,Capital Goods,Military/Government/Technical
DCP,DCP Midstream  LP Common Units ,$30.83,-0.55,-1.753%,6423818095.00,United States,,576483,Public Utilities,Natural Gas Distribution
DCP^B,DCP Midstream LP 7.875% Series B Fixed-to-Floating Rate Cumulative Redeemable Perpetual Preferred Units,$24.93,0.02,0.08%,,United States,,8955,,
DCP^C,DCP Midstream LP 7.95% Series C Fixed-to-Floating Rate Cumulative Redeemable Perpetual Preferred Units,$24.98,-0.02,-0.08%,,United States,,6247,,
DCUE,Dominion Energy Inc. 2019 Series A Corporate Units,$96.85,-0.32,-0.329%,0.00,United States,2019,186203,Public Utilities,Electric Utilities: Central
DD,DuPont de Nemours Inc. Common Stock,$69.76,-0.66,-0.937%,36488434834.00,,2017,3279628,Capital Goods,Wholesale Distributors
DDD,3D Systems Corporation Common Stock,$26.20,-0.40,-1.504%,3281170938.00,United States,,1297687,Technology,Computer peripheral equipment
DDF,Delaware Investments Dividend & Income Fund Inc. Common Stock,$11.12,0.00,0.00%,84636077.00,United States,1993,7034,Finance,Finance/Investors Services
DDL,Dingdong (Cayman) Limited American Depositary Shares (each two representing three Ordinary Shares),$23.77,-0.35,-1.451%,5610940185.00,,2021,17400,,
DDS,Dillard's Inc. Common Stock,$199.18,-0.03,-0.015%,4105746737.00,United States,,249470,Consumer Services,Department/Specialty Retail Stores
DDT,Dillard's Capital Trust I,$27.48,-0.17,-0.615%,0.00,United States,,2359,Consumer Services,Department/Specialty Retail Stores
DE,Deere & Company Common Stock,$332.59,-10.58,-3.083%,103123346968.00,United States,,1051417,Capital Goods,Industrial Machinery/Components
DEA,Easterly Government Properties Inc. Common Stock,$21.02,-0.13,-0.615%,1764529996.00,United States,2015,537738,Consumer Services,Real Estate Investment Trusts
DECK,Deckers Outdoor Corporation Common Stock,$330.70,-29.14,-8.098%,9148083661.00,United States,1993,1334235,Consumer Non-Durables,Shoe Manufacturing
DEI,Douglas Emmett Inc. Common Stock,$32.83,0.57,1.767%,5760761256.00,United States,2006,740088,Consumer Services,Real Estate Investment Trusts
DELL,Dell Technologies Inc. Class C Common Stock ,$105.20,0.14,0.133%,80490219085.00,,2018,1405018,Technology,Computer Manufacturing
DEN,Denbury Inc. Common Stock,$72.01,0.76,1.067%,3608417500.00,,2020,531890,Energy,Oil & Gas Production
DEO,Diageo plc Common Stock,$193.02,-0.71,-0.366%,112487506712.00,United Kingdom,,175996,Consumer Non-Durables,Beverages (Production/Distribution)
DESP,Despegar.com Corp. Ordinary Shares,$12.88,0.05,0.39%,902879345.00,,2017,205177,Transportation,Other Consumer Services
DEX,Delaware Enhanced Global Dividend Common Shares of Beneficial Interest,$10.155,0.005,0.049%,114793460.00,United States,2007,16183,Finance,Finance Companies
DFIN,Donnelley Financial Solutions Inc. Common Stock ,$36.68,-0.04,-0.109%,1232698634.00,,2016,171619,Finance,Investment Managers
DFP,Flaherty & Crumrine Dynamic Preferred and Income Fund Inc. Common Stock,$28.00,-0.74,-2.575%,542439408.00,,2013,248720,Finance,Investment Managers
DFS,Discover Financial Services Common Stock,$125.72,-2.63,-2.049%,37649172277.00,United States,,1407290,Finance,Finance: Consumer Services
DG,Dollar General Corporation Common Stock,$209.79,-0.61,-0.29%,48946150634.00,United States,2009,1209077,Consumer Services,Department/Specialty Retail Stores
DGX,Quest Diagnostics Incorporated Common Stock,$140.36,-1.57,-1.106%,17149291333.00,United States,,1250184,Health Care,Medical Specialities
DHF,BNY Mellon High Yield Strategies Fund Common Stock,$3.28,0.01,0.306%,238481217.00,United States,1998,195994,Finance,Finance Companies
DHI,D.R. Horton Inc. Common Stock,$83.29,-0.12,-0.144%,29834014574.00,United States,,1994235,,
DHR,Danaher Corporation Common Stock,$298.74,-1.03,-0.344%,213270356048.00,United States,,1121508,Health Care,Medical Specialities
DHR^A,Danaher Corporation 4.75% Mandatory Convertible Preferred Stock Series A,$2005.01,0.00,0.00%,,United States,,1638,,
DHR^B,Danaher Corporation 5.00% Mandatory Convertible Preferred Stock Series B,$1595.99,0.00,0.00%,,United States,,103,,
DHT,DHT Holdings Inc.,$6.63,0.20,3.11%,1113297553.00,Jersey,2005,1866393,Transportation,Marine Transportation
DHX,DHI Group Inc. Common Stock,$4.77,-0.01,-0.209%,239643679.00,United States,2007,119288,Technology,Diversified Commercial Services
DIAX,Nuveen Dow 30SM Dynamic Overwrite Fund Common Shares of Beneficial Interest,$17.22,-0.07,-0.405%,626238242.00,,2014,80350,Finance,Finance Companies
DIDI,DiDi Global Inc. American Depositary Shares (each four representing one Class A Ordinary Share),$8.38,0.21,2.57%,40418763569.00,,2021,29372075,,
DIN,Dine Brands Global Inc. Common Stock,$82.80,-0.61,-0.731%,1422174290.00,United States,,118160,Consumer Services,Restaurants
DIS,Walt Disney Company (The) Common Stock,$173.52,-3.22,-1.822%,315307806764.00,United States,,8039166,Consumer Services,Movies/Entertainment
DK,Delek US Holdings Inc. Common Stock,$19.63,0.17,0.874%,1453840535.00,United States,2017,1023227,Energy,Integrated oil Companies
DKL,Delek Logistics Partners L.P. Common Units representing Limited Partner Interests,$48.54,0.53,1.104%,2109229638.00,United States,2012,56186,Energy,Oil & Gas Production
DKS,Dick's Sporting Goods Inc Common Stock,$113.27,-2.86,-2.463%,10034350414.00,United States,2002,1380856,Consumer Services,Other Specialty Stores
DLB,Dolby Laboratories Common Stock,$87.77,-1.06,-1.193%,8898778769.00,United States,2005,122265,Technology,EDP Services
DLNG,Dynagas LNG Partners LP Common Units,$2.995,-0.055,-1.803%,110222730.00,Greece,,67736,,
DLNG^A,Dynagas LNG Partners LP 9.00% Series A Cumulative Redeemable Preferred Units,$25.50,0.05,0.196%,,Greece,,5191,,
DLNG^B,Dynagas LNG Partners LP 8.75% Series B Fixed to Floating Rate Cumulative Redeemable Perpetual Preferred Units liquidation preference $25.00 per Uni,$25.03,0.0833,0.334%,,Greece,,4873,,
DLR,Digital Realty Trust Inc. Common Stock,$139.73,-0.93,-0.661%,39644764022.00,United States,2004,1065713,Consumer Services,Real Estate Investment Trusts
DLR^J,Digital Realty Trust Inc. 5.250% Series J Cumulative Redeemable Preferred Stock,$25.7065,-0.0035,-0.014%,,United States,,2488,,
DLR^K,Digital Realty Trust Inc. 5.850% Series K Cumulative Redeemable Preferred Stock par value $0.01 per share,$27.06,-0.06,-0.221%,,United States,,11022,,
DLR^L,Digital Realty Trust Inc. 5.200% Series L Cumulative Redeemable Preferred Stock,$26.72,0.04,0.15%,,United States,,5166,,
DLX,Deluxe Corporation Common Stock,$36.47,0.32,0.885%,1551607762.00,United States,,123766,Technology,Advertising
DLY,DoubleLine Yield Opportunities Fund Common Shares of Beneficial Interest,$19.74,0.00,0.00%,946449677.00,,2020,72122,Finance,Investment Managers
DM,Desktop Metal Inc. Class A Common Stock,$6.84,-0.22,-3.116%,1783055030.00,,2019,2988692,Technology,Computer peripheral equipment
DMB,BNY Mellon Municipal Bond Infrastructure Fund Inc. Common Stock,$15.52,0.02,0.129%,285450777.00,,2013,11570,Finance,Trusts Except Educational Religious and Charitable
DMO,Western Asset Mortgage Opportunity Fund Inc. Common Stock,$15.86,-0.07,-0.439%,179624317.00,United States,2010,27363,Finance,Trusts Except Educational Religious and Charitable
DMS,Digital Media Solutions Inc. Class A Ordinary Shares,$7.16,-0.04,-0.556%,445117360.00,United States,2018,39455,Technology,Advertising
DMYQ,dMY Technology Group Inc. IV Class A Common Stock,$9.94,0.00,0.00%,428662500.00,,2021,18561,,
DNA,Ginkgo Bioworks Holdings Inc. Class A Common Stock,$9.47,-0.86,-8.325%,18536473792.00,United States,2021,5228130,Health Care,Biotechnology: Biological Products (No Diagnostic Substances)
DNB,Dun & Bradstreet Holdings Inc. Common Stock,$19.01,-0.40,-2.061%,8194914140.00,United States,2020,2856872,Technology,EDP Services
DNMR,Danimer Scientific Inc. Common Stock,$14.86,-0.15,-0.999%,1452298694.00,,2020,813354,Consumer Non-Durables,Plastic Products
DNOW,NOW Inc. Common Stock,$8.84,-0.01,-0.113%,977340066.00,,2014,775978,Energy,Metal Fabrications
DNP,DNP Select Income Fund Inc. Common Stock,$10.57,-0.02,-0.189%,3604120580.00,United States,1987,407145,Finance,Investment Managers
DNZ,D and Z Media Acquisition Corp. Class A Common Stock,$9.75,0.00,0.00%,350390625.00,,2021,1,,
DOC,Physicians Realty Trust Common Shares of Beneficial Interest,$18.22,0.04,0.22%,3961134915.00,United States,2013,1359070,Consumer Services,Real Estate Investment Trusts
DOCN,DigitalOcean Holdings Inc. Common Stock,$83.90,0.06,0.072%,9005838166.00,,2021,1221093,Technology,Retail: Computer Software & Peripheral Equipment
DOCS,Doximity Inc. Class A Common Stock,$70.38,-6.12,-8.00%,13067619430.00,,2021,2228391,Technology,Retail: Computer Software & Peripheral Equipment
DOLE,Dole plc Ordinary Shares,$15.32,0.35,2.338%,1426271226.00,,2021,160418,,Farming/Seeds/Milling
DOMA,Doma Holdings Inc. Common Stock,$6.51,-0.06,-0.913%,2101346534.00,,2021,148921,Finance,Real Estate
DOOR,Masonite International Corporation Ordinary Shares (Canada),$109.20,-1.22,-1.105%,2630776949.00,Canada,,81065,,
DOV,Dover Corporation Common Stock,$156.67,-1.17,-0.741%,22554359373.00,United States,,522556,Capital Goods,Industrial Machinery/Components
DOW,Dow Inc. Common Stock ,$58.23,-0.48,-0.818%,43426291215.00,,2019,4138430,Basic Industries,Industrial Specialties
DPG,Duff & Phelps Utility and Infrastructure Fund Inc.,$13.72,0.01,0.073%,520396938.00,United States,2011,64886,Finance,Trusts Except Educational Religious and Charitable
DPZ,Domino's Pizza Inc Common Stock,$479.48,-0.84,-0.175%,17670857090.00,United States,2004,359596,Consumer Non-Durables,Food Distributors
DQ,DAQO New Energy Corp. American Depositary Shares each representing five ordinary shares,$61.41,5.41,9.661%,4514468948.00,China,2010,2376454,Technology,Semiconductors
DRD,DRDGOLD Limited American Depositary Shares,$8.37,-0.09,-1.064%,715730242.00,South Africa,,138945,Basic Industries,Precious Metals
DRE,Duke Realty Corporation Common Stock,$50.62,0.22,0.437%,19151591605.00,United States,,682173,Consumer Services,Real Estate Investment Trusts
DRH,Diamondrock Hospitality Company Common Stock,$9.15,0.02,0.219%,1927171536.00,United States,2005,1681439,Consumer Services,Real Estate Investment Trusts
DRH^A,Diamondrock Hospitality Company 8.250% Series A Cumulative Redeemable Preferred Stock,$27.397,0.057,0.208%,,United States,,3957,,
DRI,Darden Restaurants Inc. Common Stock,$153.00,-1.58,-1.022%,19857105459.00,United States,,693768,Consumer Services,Restaurants
DRQ,Dril-Quip Inc. Common Stock,$26.52,-0.24,-0.897%,939633037.00,United States,1997,264610,Energy,Metal Fabrications
DS,Drive Shack Inc.,$2.84,0.06,2.158%,261522590.00,United States,,861118,Consumer Services,Movies/Entertainment
DS^B,Drive Shack Inc. Preferred Series B,$25.73,0.062,0.242%,,United States,,189,,
DS^C,Drive Shack Inc. Preferred Series C,$25.81,-0.32,-1.225%,,United States,,242,,
DS^D,Drive Shack Inc. Pfd Ser D,$25.61,-0.21,-0.813%,,United States,,1804,,
DSL,DoubleLine Income Solutions Fund Common Shares of Beneficial Interests,$18.04,-0.11,-0.606%,1840022777.00,,2013,259392,Finance,Trusts Except Educational Religious and Charitable
DSM,BNY Mellon Strategic Municipal Bond Fund Inc. Common Stock,$8.01,0.03,0.376%,395866303.00,United States,1989,116077,Finance,Investment Managers
DSU,Blackrock Debt Strategies Fund Inc. Common Stock,$11.51,0.03,0.261%,536271699.00,United States,1998,87775,Finance,Finance Companies
DSX,Diana Shipping inc. common stock,$5.51,-0.09,-1.607%,504357861.00,Greece,2005,776707,Transportation,Marine Transportation
DSX^B,Diana Shipping Inc. Perpetual Preferred Shares Series B (Marshall Islands),$26.4499,0.2479,0.946%,,Greece,,2865,,
DT,Dynatrace Inc. Common Stock,$71.53,0.29,0.407%,20335002401.00,United States,2019,536533,Technology,EDP Services
DTB,DTE Energy Company 2020 Series G 4.375% Junior Subordinated Debentures due 2080,$25.30,0.07,0.277%,0.00,United States,2020,15553,Public Utilities,Electric Utilities: Central
DTE,DTE Energy Company Common Stock,$112.15,-1.98,-1.735%,21729236781.00,United States,,753388,Public Utilities,Electric Utilities: Central
DTF,DTF Tax-Free Income Inc. Common Stock,$14.35,-0.01,-0.07%,100874286.00,United States,1991,2706,Finance,Investment Managers
DTLA^,Brookfield DTLA Inc. 7.625% Series A Cumulative Redeemable Preferred Stock,$13.85,-0.22,-1.564%,,,,2417,,
DTM,DT Midstream Inc. Common Stock ,$48.80,0.19,0.391%,4720544341.00,,2021,435611,Public Utilities,Oil & Gas Production
DTP,DTE Energy Company 6.25% Corporate Units,$50.25,-0.49,-0.966%,0.00,United States,,31285,Public Utilities,Electric Utilities: Central
DTW,DTE Energy Company 2017 Series E 5.25% Junior Subordinated Debentures due 2077,$25.97,0.01,0.039%,0.00,United States,2017,20782,Public Utilities,Electric Utilities: Central
DTY,DTE Energy Company 2016 Series F 6.00% Junior Subordinated Debentures due 2076,$25.40,-0.01,-0.039%,0.00,United States,2016,9678,,
DUK,Duke Energy Corporation (Holding Company) Common Stock,$99.71,-0.82,-0.816%,76710651897.00,United States,,1659654,Public Utilities,Power Generation
DUK^A,Duke Energy Corporation Depositary Shares each representing a 1/1000th interest in a share of 5.75% Series A Cumulative Redeemable Perpetual Preferred Stock,$27.35,0.11,0.404%,,United States,,32379,,
DUKB,Duke Energy Corporation 5.625% Junior Subordinated Debentures due 2078,$26.95,0.09,0.335%,0.00,United States,2018,28701,Public Utilities,Power Generation
DV,DoubleVerify Holdings Inc. Common Stock,$31.63,-2.90,-8.398%,4992833583.00,,2021,597416,Technology,Computer Software: Prepackaged Software
DVA,DaVita Inc. Common Stock,$111.54,-1.68,-1.484%,11682187185.00,United States,,529814,Health Care,Medical/Nursing Services
DVD,Dover Motorsports Inc. Common Stock,$2.4107,-0.0593,-2.401%,87859386.00,United States,1996,23059,Consumer Services,Services-Misc. Amusement & Recreation
DVN,Devon Energy Corporation Common Stock,$39.45,-0.41,-1.029%,26707650000.00,United States,,10098744,Energy,Oil & Gas Production
DWIN,Delwinds Insurance Acquisition Corp. Class A Common Stock,$9.87,0.00,0.00%,254534963.00,,2021,9484,,
DX,Dynex Capital Inc. Common Stock,$17.67,0.06,0.341%,611232423.00,United States,,324290,Consumer Services,Real Estate Investment Trusts
DX^C,Dynex Capital Inc. 6.900% Series C Fixed-to-Floating Rate Cumulative Redeemable Preferred Stock,$25.51,0.00,0.00%,,United States,,28686,,
DXC,DXC Technology Company Common Stock ,$33.73,-0.62,-1.805%,8496730083.00,,,1403703,Technology,EDP Services
DY,Dycom Industries Inc. Common Stock,$68.01,-2.04,-2.912%,2051902506.00,United States,,179091,Basic Industries,Water Supply
DYFN,Angel Oak Dynamic Financial Strategies Income Term Trust Common Shares of Beneficial Interest,$20.47,0.21,1.037%,83005850.00,,2020,9503,Finance,Finance/Investors Services
E,ENI S.p.A. Common Stock,$27.61,0.15,0.546%,49167864973.00,Italy,,700125,Energy,Oil & Gas Production
EAF,GrafTech International Ltd. Common Stock,$10.39,-0.11,-1.048%,2783281013.00,United States,2018,1762729,Consumer Durables,Metal Fabrications
EAI,Entergy Arkansas LLC First Mortgage Bonds 4.875% Series Due September 1 2066,$25.1901,-0.0199,-0.079%,0.00,United States,2016,8496,,
EARN,Ellington Residential Mortgage REIT Common Shares of Beneficial Interest,$11.68,-0.02,-0.171%,150888571.00,United States,2013,109203,Consumer Services,Real Estate Investment Trusts
EAT,Brinker International Inc. Common Stock,$50.20,0.92,1.867%,2279680593.00,United States,,624448,Consumer Services,Restaurants
EB,Eventbrite Inc. Class A Common Stock,$20.09,0.31,1.567%,1894636891.00,United States,2018,943681,Technology,EDP Services
EBF,Ennis Inc. Common Stock,$18.74,-0.16,-0.847%,489516217.00,United States,,74609,Consumer Services,Office Equipment/Supplies/Services
EBR,Centrais Electricas Brasileiras S A American Depositary Shares (Each representing one Common Share),$7.14,0.17,2.439%,11202166697.00,,2016,3760345,Public Utilities,Electric Utilities: Central
EBS,Emergent Biosolutions Inc. Common Stock,$51.58,-0.88,-1.677%,2769883602.00,United States,2006,226276,Health Care,Biotechnology: Pharmaceutical Preparations
